"Status","Start Time","Stop Time","Duration in ms","Parent Suite","Suite","Sub Suite","Test Class","Test Method","Name","Description"
"passed","Sat Apr 27 01:44:32 UTC 2024","Sat Apr 27 01:44:33 UTC 2024","1027","tests.integration","test_password_rotation","","","","test_db_connection_with_empty_password","Test that user can't connect with empty password."
"passed","Sat Apr 27 01:34:25 UTC 2024","Sat Apr 27 01:34:53 UTC 2024","27441","tests.integration.new_relations","test_new_relations","","","","test_no_read_only_endpoint_in_standalone_cluster","Test that there is no read-only endpoint in a standalone cluster."
"passed","Sat Apr 27 01:44:33 UTC 2024","Sat Apr 27 01:44:42 UTC 2024","9403","tests.integration","test_password_rotation","","","","test_no_password_change_on_invalid_password","Test that in general, there is no change when password validation fails."
"passed","Sat Apr 27 01:39:26 UTC 2024","Sat Apr 27 01:40:53 UTC 2024","87080","tests.integration.new_relations","test_new_relations","","","","test_two_applications_doesnt_share_the_same_relation_data","Test that two different application connect to the database with different credentials."
"passed","Sat Apr 27 01:43:49 UTC 2024","Sat Apr 27 01:46:56 UTC 2024","186861","tests.integration.ha_tests","test_upgrade","","","","test_fail_and_rollback",""
"passed","Sat Apr 27 01:51:10 UTC 2024","Sat Apr 27 01:52:09 UTC 2024","59133","tests.integration.new_relations","test_new_relations","","","","test_relation_with_no_database_name","Test that a relation with no database name doesn't block the charm."
"passed","Sat Apr 27 01:47:22 UTC 2024","Sat Apr 27 01:49:00 UTC 2024","98171","tests.integration","test_subordinates","","","","test_scale_down",""
"passed","Sat Apr 27 01:26:31 UTC 2024","Sat Apr 27 01:38:15 UTC 2024","703913","tests.integration.ha_tests","test_replication","","","","test_build_and_deploy","Build and deploy three unit of PostgreSQL."
"passed","Sat Apr 27 01:28:18 UTC 2024","Sat Apr 27 01:39:32 UTC 2024","674315","tests.integration","test_db","","","","test_mailman3_core_db","Deploy Mailman3 Core to test the 'db' relation."
"passed","Sat Apr 27 01:26:36 UTC 2024","Sat Apr 27 01:37:48 UTC 2024","672070","tests.integration.ha_tests","test_upgrade_from_stable","","","","test_deploy_stable","Simple test to ensure that the PostgreSQL and application charms get deployed."
"passed","Sat Apr 27 01:37:47 UTC 2024","Sat Apr 27 01:37:48 UTC 2024","1029","tests.integration","test_charm","","","","test_settings_are_correct[2]",""
"passed","Sat Apr 27 01:37:44 UTC 2024","Sat Apr 27 01:37:45 UTC 2024","1033","tests.integration","test_charm","","","","test_settings_are_correct[0]",""
"passed","Sat Apr 27 01:37:44 UTC 2024","Sat Apr 27 01:37:44 UTC 2024","56","tests.integration","test_charm","","","","test_exporter_is_up[1]",""
"passed","Sat Apr 27 01:40:27 UTC 2024","Sat Apr 27 01:49:13 UTC 2024","525568","tests.integration.ha_tests","test_replication","","","","test_no_data_replicated_between_clusters","Check that writes in one cluster are not replicated to another cluster."
"passed","Sat Apr 27 01:37:28 UTC 2024","Sat Apr 27 01:43:48 UTC 2024","380235","tests.integration.ha_tests","test_upgrade","","","","test_upgrade_from_edge",""
"passed","Sat Apr 27 01:41:55 UTC 2024","Sat Apr 27 01:42:19 UTC 2024","24056","tests.integration.new_relations","test_new_relations","","","","test_an_application_can_request_multiple_databases","Test that an application can request additional databases using the same interface."
"passed","Sat Apr 27 01:26:51 UTC 2024","Sat Apr 27 01:38:39 UTC 2024","708163","tests.integration","test_password_rotation","","","","test_deploy_active","Build the charm and deploy it."
"passed","Sat Apr 27 01:39:22 UTC 2024","Sat Apr 27 01:39:25 UTC 2024","3150","tests.integration.new_relations","test_new_relations","","","","test_database_relation_with_charm_libraries","Test basic functionality of database relation interface."
"passed","Sat Apr 27 01:26:54 UTC 2024","Sat Apr 27 01:37:49 UTC 2024","654985","tests.integration","test_plugins","","","","test_plugins","Build and deploy one unit of PostgreSQL and then test the available plugins."
"passed","Sat Apr 27 01:50:51 UTC 2024","Sat Apr 27 01:59:59 UTC 2024","547213","tests.integration","test_db","","","","test_sentry_db_blocked",""
"passed","Sat Apr 27 01:37:48 UTC 2024","Sat Apr 27 01:37:50 UTC 2024","2214","tests.integration.ha_tests","test_upgrade_from_stable","","","","test_pre_upgrade_check","Test that the pre-upgrade-check action runs successfully."
"passed","Sat Apr 27 01:37:44 UTC 2024","Sat Apr 27 01:37:44 UTC 2024","57","tests.integration","test_charm","","","","test_exporter_is_up[2]",""
"passed","Sat Apr 27 01:52:23 UTC 2024","Sat Apr 27 02:02:04 UTC 2024","580508","tests.integration","test_backups","","","","test_invalid_config_and_recovery_after_fixing_it","Test that the charm can handle invalid and valid backup configurations."
"passed","Sat Apr 27 01:59:59 UTC 2024","Sat Apr 27 02:01:46 UTC 2024","106986","tests.integration","test_db","","","","test_roles_blocking",""
"passed","Sat Apr 27 01:37:44 UTC 2024","Sat Apr 27 01:37:44 UTC 2024","3","tests.integration","test_charm","","","","test_database_is_up[2]",""
"skipped","Sat Apr 27 01:44:18 UTC 2024","Sat Apr 27 01:44:18 UTC 2024","0","tests.integration","test_tls","","","","test_restart_machine",""
"passed","Sat Apr 27 01:39:32 UTC 2024","Sat Apr 27 01:50:51 UTC 2024","679437","tests.integration","test_db","","","","test_relation_data_is_updated_correctly_when_scaling","Test that relation data, like connection data, is updated correctly when scaling."
"passed","Sat Apr 27 01:26:55 UTC 2024","Sat Apr 27 01:42:09 UTC 2024","913727","tests.integration","test_subordinates","","","","test_deploy",""
"passed","Sat Apr 27 01:37:44 UTC 2024","Sat Apr 27 01:37:44 UTC 2024","3","tests.integration","test_charm","","","","test_database_is_up[1]",""
"passed","Sat Apr 27 01:37:50 UTC 2024","Sat Apr 27 01:42:52 UTC 2024","301762","tests.integration.ha_tests","test_upgrade_from_stable","","","","test_upgrade_from_stable","Test updating from stable channel."
"passed","Sat Apr 27 01:26:26 UTC 2024","Sat Apr 27 01:40:18 UTC 2024","831839","tests.integration","test_config","","","","test_config_parameters","Build and deploy one unit of PostgreSQL and then test config with wrong parameters."
"passed","Sat Apr 27 01:37:44 UTC 2024","Sat Apr 27 01:37:44 UTC 2024","4","tests.integration","test_charm","","","","test_database_is_up[0]",""
"passed","Sat Apr 27 01:26:32 UTC 2024","Sat Apr 27 01:34:25 UTC 2024","473466","tests.integration.new_relations","test_new_relations","","","","test_deploy_charms","Deploy both charms (application and database) to use in the tests."
"passed","Sat Apr 27 01:42:09 UTC 2024","Sat Apr 27 01:47:22 UTC 2024","313533","tests.integration","test_subordinates","","","","test_scale_up",""
"passed","Sat Apr 27 01:37:45 UTC 2024","Sat Apr 27 01:37:47 UTC 2024","2051","tests.integration","test_charm","","","","test_settings_are_correct[1]",""
"passed","Sat Apr 27 01:35:39 UTC 2024","Sat Apr 27 02:04:31 UTC 2024","1731666","tests.integration","test_db_admin","","","","test_landscape_scalable_bundle_db","Deploy Landscape Scalable Bundle to test the 'db-admin' relation."
"passed","Sat Apr 27 01:27:35 UTC 2024","Sat Apr 27 01:43:11 UTC 2024","936866","tests.integration.ha_tests","test_restore_cluster","","","","test_build_and_deploy","Build and deploy two PostgreSQL clusters."
"passed","Sat Apr 27 01:57:05 UTC 2024","Sat Apr 27 02:02:33 UTC 2024","327981","tests.integration.new_relations","test_new_relations","","","","test_nextcloud_db_blocked",""
"passed","Sat Apr 27 01:52:09 UTC 2024","Sat Apr 27 01:54:07 UTC 2024","118133","tests.integration.new_relations","test_new_relations","","","","test_admin_role","Test that the admin role gives access to all the databases."
"passed","Sat Apr 27 01:37:25 UTC 2024","Sat Apr 27 01:37:28 UTC 2024","3386","tests.integration.ha_tests","test_upgrade","","","","test_pre_upgrade_check","Test that the pre-upgrade-check action runs successfully."
"passed","Sat Apr 27 01:43:49 UTC 2024","Sat Apr 27 01:44:32 UTC 2024","43237","tests.integration","test_password_rotation","","","","test_empty_password","Test that the password can't be set to an empty string."
"passed","Sat Apr 27 01:38:39 UTC 2024","Sat Apr 27 01:43:47 UTC 2024","308502","tests.integration","test_password_rotation","","","","test_password_rotation","Test password rotation action."
"passed","Sat Apr 27 01:39:25 UTC 2024","Sat Apr 27 01:39:26 UTC 2024","791","tests.integration.new_relations","test_new_relations","","","","test_user_with_extra_roles","Test superuser actions and the request for more permissions."
"passed","Sat Apr 27 01:26:56 UTC 2024","Sat Apr 27 01:37:43 UTC 2024","647437","tests.integration","test_charm","","","","test_deploy","Deploy the charm-under-test.

    Assert on the unit status before any relations/configurations take place.
    "
"passed","Sat Apr 27 01:54:07 UTC 2024","Sat Apr 27 01:57:05 UTC 2024","178414","tests.integration.new_relations","test_new_relations","","","","test_invalid_extra_user_roles",""
"passed","Sat Apr 27 01:38:19 UTC 2024","Sat Apr 27 01:40:13 UTC 2024","114228","tests.integration.ha_tests","test_replication","","","","test_reelection","Kill primary unit, check reelection."
"passed","Sat Apr 27 01:34:53 UTC 2024","Sat Apr 27 01:39:22 UTC 2024","269097","tests.integration.new_relations","test_new_relations","","","","test_read_only_endpoint_in_scaled_up_cluster","Test that there is read-only endpoint in a scaled up cluster."
"passed","Sat Apr 27 01:40:53 UTC 2024","Sat Apr 27 01:41:23 UTC 2024","30556","tests.integration.new_relations","test_new_relations","","","","test_an_application_can_connect_to_multiple_database_clusters","Test that an application can connect to different clusters of the same database."
"skipped","Sat Apr 27 02:01:46 UTC 2024","Sat Apr 27 02:01:46 UTC 2024","0","tests.integration","test_db","","","","test_canonical_livepatch_onprem_bundle_db",""
"passed","Sat Apr 27 01:26:38 UTC 2024","Sat Apr 27 01:44:18 UTC 2024","1059667","tests.integration","test_tls","","","","test_tls_enabled","Test that TLS is enabled when relating to the TLS Certificates Operator."
"passed","Sat Apr 27 01:26:56 UTC 2024","Sat Apr 27 01:52:06 UTC 2024","1509867","tests.integration","test_backups","","","","test_backup","Build and deploy two units of PostgreSQL and then test the backup and restore actions."
"passed","Sat Apr 27 01:41:23 UTC 2024","Sat Apr 27 01:41:55 UTC 2024","31904","tests.integration.new_relations","test_new_relations","","","","test_an_application_can_connect_to_multiple_aliased_database_clusters","Test that an application can connect to different clusters of the same database."
"passed","Sat Apr 27 01:58:30 UTC 2024","Sat Apr 27 02:03:19 UTC 2024","289283","tests.integration","test_charm","","","","test_persist_data_through_primary_deletion","Test data persists through a primary deletion."
"passed","Sat Apr 27 01:26:31 UTC 2024","Sat Apr 27 01:26:38 UTC 2024","7196","tests.integration","test_tls","","","","test_deploy_active","Build the charm and deploy it."
"passed","Sat Apr 27 01:37:44 UTC 2024","Sat Apr 27 01:37:44 UTC 2024","47","tests.integration","test_charm","","","","test_exporter_is_up[0]",""
"passed","Sat Apr 27 01:40:14 UTC 2024","Sat Apr 27 01:40:26 UTC 2024","12004","tests.integration.ha_tests","test_replication","","","","test_consistency","Write to primary, read data from secondaries (check consistency)."
"passed","Sat Apr 27 01:26:35 UTC 2024","Sat Apr 27 01:37:25 UTC 2024","649646","tests.integration.ha_tests","test_upgrade","","","","test_deploy_latest","Simple test to ensure that the PostgreSQL and application charms get deployed."
"passed","Sat Apr 27 01:43:11 UTC 2024","Sat Apr 27 02:00:16 UTC 2024","1024403","tests.integration.ha_tests","test_restore_cluster","","","","test_cluster_restore","Recreates the cluster from storage volumes."
"passed","Sat Apr 27 01:39:59 UTC 2024","Sat Apr 27 01:58:30 UTC 2024","1110964","tests.integration","test_charm","","","","test_scale_down_and_up","Test data is replicated to new units after a scale up."
"passed","Sat Apr 27 01:43:47 UTC 2024","Sat Apr 27 01:43:49 UTC 2024","1331","tests.integration","test_password_rotation","","","","test_password_from_secret_same_as_cli","Checking if password is same as returned by CLI.

    I.e. we're manipulating the secret we think we're manipulating.
    "
"passed","Sat Apr 27 01:37:48 UTC 2024","Sat Apr 27 01:39:59 UTC 2024","131295","tests.integration","test_charm","","","","test_postgresql_parameters_change","Test that's possible to change PostgreSQL parameters."
"passed","Sat Apr 27 01:42:19 UTC 2024","Sat Apr 27 01:51:10 UTC 2024","530519","tests.integration.new_relations","test_new_relations","","","","test_relation_data_is_updated_correctly_when_scaling","Test that relation data, like connection data, is updated correctly when scaling."
"broken","Sat Apr 27 01:52:06 UTC 2024","Sat Apr 27 01:52:23 UTC 2024","17618","tests.integration","test_backups","","","","test_restore_on_new_cluster","Test that is possible to restore a backup to another PostgreSQL cluster."
